[
  {
    "eventVersion": "1.0",
    "eventType": "ptree.catalog.part.changed",
    "correlationId": "a1b2c3d4-e5f6-7890-abcd-ef1234567890",
    "sourceCollection": "products",
    "sourceId": "ARIPS22PRT 3035744",
    "entityType": "part",
    "changeType": "update",
    "documentKey": { "_id": "507f1f77bcf86cd799439011" },
    "workflowHint": { "approved": true, "deleted": false },
    "emittedAt": "2026-06-02T12:00:00.000Z",
    "changeStreamToken": "82667292700000000000000000000000000000000000000000000000000000000000000000"
  },
  {
    "eventVersion": "1.0",
    "eventType": "ptree.catalog.model.changed",
    "correlationId": "b2c3d4e5-f6a7-8901-bcde-f12345678901",
    "sourceCollection": "products",
    "sourceId": "ARIPS01MDL 190-118-000 Mulch Kit (2010)",
    "entityType": "model",
    "changeType": "update",
    "workflowHint": { "approved": true, "deleted": true },
    "emittedAt": "2026-06-02T12:01:00.000Z"
  },
  {
    "eventVersion": "1.0",
    "eventType": "ptree.catalog.inventory.changed",
    "correlationId": "c3d4e5f6-a7b8-9012-cdef-123456789012",
    "sourceCollection": "inventory",
    "sourceId": "CSYSHOM 532410001",
    "entityType": "inventory",
    "changeType": "replace",
    "workflowHint": { "approved": true, "deleted": false },
    "emittedAt": "2026-06-02T12:02:00.000Z"
  },
  {
    "eventVersion": "1.0",
    "eventType": "ptree.catalog.ipl.changed",
    "correlationId": "d4e5f6a7-b8c9-0123-def0-234567890123",
    "sourceCollection": "assets",
    "sourceId": "ARIPS01IPL W0093000001",
    "entityType": "ipl",
    "changeType": "insert",
    "emittedAt": "2026-06-02T12:03:00.000Z"
  },
  {
    "eventVersion": "1.0",
    "eventType": "ptree.catalog.media.changed",
    "correlationId": "e5f6a7b8-c9d0-1234-ef01-345678901234",
    "sourceCollection": "assets",
    "sourceId": "CSYSSNA 703065 5672e00b7067b",
    "entityType": "media",
    "changeType": "update",
    "emittedAt": "2026-06-02T12:04:00.000Z"
  }
]
